{
  "dataset": "contract_reconciliation",
  "analytics_as_of": "2026-03-19T03:35:14.475549Z",
  "as_of": "2026-03-19T03:35:14.475549Z",
  "version": 1,
  "summary": {
    "matched_count": 6,
    "needs_review_count": 0,
    "chain_only_count": 14,
    "site_only_count": 0
  },
  "records": [
    {
      "contract_id": "gnars-base-token-nft",
      "ecosystem": "gnars",
      "network": "base",
      "address": "0x880fb3cf5c6cc2d7dfc13a993e839a9411200c17",
      "kind": "erc721",
      "label": "Gnars NFT",
      "status": "active",
      "repo_value": {
        "address": "0x880fb3cf5c6cc2d7dfc13a993e839a9411200c17",
        "label": "Gnars NFT",
        "kind": "erc721",
        "network": "base",
        "status": "active"
      },
      "site_value": {
        "present_on_site": true,
        "source_urls": [
          "https://www.gnars.com/"
        ]
      },
      "chain_value": {
        "address": "0x880fb3cf5c6cc2d7dfc13a993e839a9411200c17",
        "explorer_url": "https://basescan.org/address/0x880fb3cf5c6cc2d7dfc13a993e839a9411200c17"
      },
      "resolved_value": {
        "label": "Gnars NFT",
        "address": "0x880fb3cf5c6cc2d7dfc13a993e839a9411200c17",
        "kind": "erc721",
        "network": "base"
      },
      "reconciliation_status": "matched",
      "evidence_urls": [
        "https://www.gnars.com/",
        "https://basescan.org/address/0x880fb3cf5c6cc2d7dfc13a993e839a9411200c17"
      ]
    },
    {
      "contract_id": "gnars-base-token-erc20",
      "ecosystem": "gnars",
      "network": "base",
      "address": "0x0cf0c3b75d522290d7d12c74d7f1f0cc47ccb23b",
      "kind": "erc20",
      "label": "$GNARS",
      "status": "active",
      "repo_value": {
        "address": "0x0cf0c3b75d522290d7d12c74d7f1f0cc47ccb23b",
        "label": "$GNARS",
        "kind": "erc20",
        "network": "base",
        "status": "active"
      },
      "site_value": {
        "present_on_site": true,
        "source_urls": [
          "https://www.gnars.com/"
        ]
      },
      "chain_value": {
        "address": "0x0cf0c3b75d522290d7d12c74d7f1f0cc47ccb23b",
        "explorer_url": "https://basescan.org/address/0x0cf0c3b75d522290d7d12c74d7f1f0cc47ccb23b"
      },
      "resolved_value": {
        "label": "$GNARS",
        "address": "0x0cf0c3b75d522290d7d12c74d7f1f0cc47ccb23b",
        "kind": "erc20",
        "network": "base"
      },
      "reconciliation_status": "matched",
      "evidence_urls": [
        "https://www.gnars.com/",
        "https://basescan.org/address/0x0cf0c3b75d522290d7d12c74d7f1f0cc47ccb23b"
      ]
    },
    {
      "contract_id": "gnars-base-auction-house",
      "ecosystem": "gnars",
      "network": "base",
      "address": "0x494eaa55ecf6310658b8fc004b0888dcb698097f",
      "kind": "auction_house",
      "label": "Gnars Auction House",
      "status": "active",
      "repo_value": {
        "address": "0x494eaa55ecf6310658b8fc004b0888dcb698097f",
        "label": "Gnars Auction House",
        "kind": "auction_house",
        "network": "base",
        "status": "active"
      },
      "site_value": {
        "present_on_site": true,
        "source_urls": [
          "https://www.gnars.com/"
        ]
      },
      "chain_value": {
        "address": "0x494eaa55ecf6310658b8fc004b0888dcb698097f",
        "explorer_url": "https://basescan.org/address/0x494eaa55ecf6310658b8fc004b0888dcb698097f"
      },
      "resolved_value": {
        "label": "Gnars Auction House",
        "address": "0x494eaa55ecf6310658b8fc004b0888dcb698097f",
        "kind": "auction_house",
        "network": "base"
      },
      "reconciliation_status": "matched",
      "evidence_urls": [
        "https://www.gnars.com/",
        "https://basescan.org/address/0x494eaa55ecf6310658b8fc004b0888dcb698097f"
      ]
    },
    {
      "contract_id": "gnars-base-governor",
      "ecosystem": "gnars",
      "network": "base",
      "address": "0x3dd4e53a232b7b715c9ae455f4e732465ed71b4c",
      "kind": "governor",
      "label": "Gnars Governor",
      "status": "active",
      "repo_value": {
        "address": "0x3dd4e53a232b7b715c9ae455f4e732465ed71b4c",
        "label": "Gnars Governor",
        "kind": "governor",
        "network": "base",
        "status": "active"
      },
      "site_value": {
        "present_on_site": true,
        "source_urls": [
          "https://www.gnars.com/"
        ]
      },
      "chain_value": {
        "address": "0x3dd4e53a232b7b715c9ae455f4e732465ed71b4c",
        "explorer_url": "https://basescan.org/address/0x3dd4e53a232b7b715c9ae455f4e732465ed71b4c"
      },
      "resolved_value": {
        "label": "Gnars Governor",
        "address": "0x3dd4e53a232b7b715c9ae455f4e732465ed71b4c",
        "kind": "governor",
        "network": "base"
      },
      "reconciliation_status": "matched",
      "evidence_urls": [
        "https://www.gnars.com/",
        "https://basescan.org/address/0x3dd4e53a232b7b715c9ae455f4e732465ed71b4c"
      ]
    },
    {
      "contract_id": "gnars-base-treasury",
      "ecosystem": "gnars",
      "network": "base",
      "address": "0x72ad986ebac0246d2b3c565ab2a1ce3a14ce6f88",
      "kind": "treasury",
      "label": "Gnars Treasury",
      "status": "active",
      "repo_value": {
        "address": "0x72ad986ebac0246d2b3c565ab2a1ce3a14ce6f88",
        "label": "Gnars Treasury",
        "kind": "treasury",
        "network": "base",
        "status": "active"
      },
      "site_value": {
        "present_on_site": true,
        "source_urls": [
          "https://www.gnars.com/"
        ]
      },
      "chain_value": {
        "address": "0x72ad986ebac0246d2b3c565ab2a1ce3a14ce6f88",
        "explorer_url": "https://basescan.org/address/0x72ad986ebac0246d2b3c565ab2a1ce3a14ce6f88"
      },
      "resolved_value": {
        "label": "Gnars Treasury",
        "address": "0x72ad986ebac0246d2b3c565ab2a1ce3a14ce6f88",
        "kind": "treasury",
        "network": "base"
      },
      "reconciliation_status": "matched",
      "evidence_urls": [
        "https://www.gnars.com/",
        "https://basescan.org/address/0x72ad986ebac0246d2b3c565ab2a1ce3a14ce6f88"
      ]
    },
    {
      "contract_id": "gnars-base-metadata",
      "ecosystem": "gnars",
      "network": "base",
      "address": "0xdc9799d424ebfdcf5310f3bad3ddcce3931d4b58",
      "kind": "metadata",
      "label": "Gnars Metadata",
      "status": "active",
      "repo_value": {
        "address": "0xdc9799d424ebfdcf5310f3bad3ddcce3931d4b58",
        "label": "Gnars Metadata",
        "kind": "metadata",
        "network": "base",
        "status": "active"
      },
      "site_value": {
        "present_on_site": true,
        "source_urls": [
          "https://www.gnars.com/"
        ]
      },
      "chain_value": {
        "address": "0xdc9799d424ebfdcf5310f3bad3ddcce3931d4b58",
        "explorer_url": "https://basescan.org/address/0xdc9799d424ebfdcf5310f3bad3ddcce3931d4b58"
      },
      "resolved_value": {
        "label": "Gnars Metadata",
        "address": "0xdc9799d424ebfdcf5310f3bad3ddcce3931d4b58",
        "kind": "metadata",
        "network": "base"
      },
      "reconciliation_status": "matched",
      "evidence_urls": [
        "https://www.gnars.com/",
        "https://basescan.org/address/0xdc9799d424ebfdcf5310f3bad3ddcce3931d4b58"
      ]
    },
    {
      "contract_id": "gnars-ethereum-token-v1",
      "ecosystem": "gnars",
      "network": "ethereum",
      "address": "0x494715b2a3c75dadd24929835b658a1c19bd4552",
      "kind": "erc721",
      "label": "Gnars Token V1",
      "status": "legacy",
      "repo_value": {
        "address": "0x494715b2a3c75dadd24929835b658a1c19bd4552",
        "label": "Gnars Token V1",
        "kind": "erc721",
        "network": "ethereum",
        "status": "legacy"
      },
      "site_value": {
        "present_on_site": false,
        "source_urls": []
      },
      "chain_value": {
        "address": "0x494715b2a3c75dadd24929835b658a1c19bd4552",
        "explorer_url": "https://etherscan.io/address/0x494715b2a3c75dadd24929835b658a1c19bd4552"
      },
      "resolved_value": {
        "label": "Gnars Token V1",
        "address": "0x494715b2a3c75dadd24929835b658a1c19bd4552",
        "kind": "erc721",
        "network": "ethereum"
      },
      "reconciliation_status": "chain-only",
      "evidence_urls": [
        "https://www.gnars.wtf/",
        "https://etherscan.io/address/0x494715b2a3c75dadd24929835b658a1c19bd4552"
      ]
    },
    {
      "contract_id": "gnars-ethereum-token-v2",
      "ecosystem": "gnars",
      "network": "ethereum",
      "address": "0x558bfff0d583416f7c4e380625c7865821b8e95c",
      "kind": "erc721",
      "label": "Gnars Token V2",
      "status": "legacy",
      "repo_value": {
        "address": "0x558bfff0d583416f7c4e380625c7865821b8e95c",
        "label": "Gnars Token V2",
        "kind": "erc721",
        "network": "ethereum",
        "status": "legacy"
      },
      "site_value": {
        "present_on_site": false,
        "source_urls": []
      },
      "chain_value": {
        "address": "0x558bfff0d583416f7c4e380625c7865821b8e95c",
        "explorer_url": "https://etherscan.io/address/0x558bfff0d583416f7c4e380625c7865821b8e95c"
      },
      "resolved_value": {
        "label": "Gnars Token V2",
        "address": "0x558bfff0d583416f7c4e380625c7865821b8e95c",
        "kind": "erc721",
        "network": "ethereum"
      },
      "reconciliation_status": "chain-only",
      "evidence_urls": [
        "https://www.gnars.wtf/",
        "https://etherscan.io/address/0x558bfff0d583416f7c4e380625c7865821b8e95c"
      ]
    },
    {
      "contract_id": "gnars-ethereum-dao-proxy-v2",
      "ecosystem": "gnars",
      "network": "ethereum",
      "address": "0x156e94a6e16244ccfdf16e1193198ea9d80dd7e3",
      "kind": "governor",
      "label": "Gnars DAO Proxy V2",
      "status": "legacy",
      "repo_value": {